ItemCode,Name,DetailDesc,Category,Packaging,SCName,TCName,SCDetailDesc,TCDetailDesc,SCPackaging,TCPackaging
MS0000001,Wireless Controller,Wireless Controller for Xbox use,XBOX,Box,无线控制器,無線控制器,Xbox专用的无线控制器,Xbox專用的無線控制器,盒装,盒裝
MS0000002,Stereo Headset,Stereo Headset for Xbox use,XBOX,Set,立体声耳机,立體聲耳機,Xbox专用的立体声耳机,Xbox專用的立體聲耳機,组,組
SN0000001,Handheld GPS Receiver,PSP can enable GPS function after connecting PSP,PSP,Piece,手持GPS接收器,手持GPS接收器,PSP专用的GPS接收器，接驳PSP后可使PSP启用GPS功能,PSP專用的GPS接收器，接駁PSP後可使PSP啟用GPS功能,个,個
SN0000002,Case and Game Case,Case for PSP use and game holder,PSP,Set,PSP机壳及游戏盒,PSP機殼及遊戲盒,PSP专用的机壳及可载游戏卡的盒,PSP專用的機殼及可載遊戲卡的盒,套,套
SN0000003,Cable Lead Cord,Connect charger and charging line of the main body of PSP,PSP,Piece,充电线,充電線,连接充电器及PSP本机主体的充电线,連接充電器及PSP本機主體的充電線,条,條
